{
  "contract_version": "1.0.0",
  "article_id": "uro.article.contract-test",
  "article_revision_id": "uro.article.contract-test.v1",
  "topic_id": "uro.topic.contract-test",
  "slug": "contract-test",
  "title": "Contract compatibility article",
  "publication_state": "published",
  "coverage_state": "partially_published",
  "authorship_class": "ai_generated",
  "human_review_scope": "none",
  "machine_check_status": "automated_checks_passed",
  "claim_counts": {
    "total": 1,
    "actionable": 0,
    "under_challenge": 0,
    "safety_hold": 0,
    "contested": 0,
    "withdrawn": 0
  },
  "contributions": [
    {
      "contribution_id": "uro.contribution.01ARZ3NDEKTSV4RRFFQ69G5FAV",
      "component_id": "uro.component.contract-test.summary",
      "authorship_class": "ai_generated",
      "contribution_type": "generated",
      "model_run_ids": ["uro.model-run.01ARZ3NDEKTSV4RRFFQ69G5FB0"],
      "public_attribution": null,
      "contribution_diff_hash": "aaaaaaaaaaaaaaaaaaaaaaaaaaaaaaaaaaaaaaaaaaaaaaaaaaaaaaaaaaaaaaaa",
      "license_record_id": "uro.license.01ARZ3NDEKTSV4RRFFQ69G5FB1",
      "created_at": "2026-09-23T12:00:00Z"
    }
  ],
  "review_annotations": [],
  "claims": [
    {
      "contract_version": "1.0.0",
      "claim_id": "uro.contract-test.0001",
      "claim_revision_id": "uro.contract-test.0001.v1",
      "article_revision_id": "uro.article.contract-test.v1",
      "component_id": "uro.component.contract-test.summary",
      "text": "This nonclinical compatibility statement exercises the public schema.",
      "text_sha256": "1111111111111111111111111111111111111111111111111111111111111111",
      "actionable": false,
      "claim_type": "background",
      "criticality": "low",
      "question_id": null,
      "support_links": [
        {
          "source_id": "uro.source.01ARZ3NDEKTSV4RRFFQ69G5FAX",
          "source_version_id": "uro.source-version.01ARZ3NDEKTSV4RRFFQ69G5FAZ",
          "study_result_id": null,
          "support_locator": "compatibility-vector",
          "relation": "supports",
          "integrity_status": "current"
        }
      ],
      "freshness": "current",
      "freshness_reason_id": null,
      "verification": {
        "metadata": "pass",
        "support": "pass",
        "verifier_run_ids": ["uro.model-run.01ARZ3NDEKTSV4RRFFQ69G5FB0"]
      },
      "state": "active",
      "authorship": {
        "class": "ai_generated",
        "contribution_record_ids": ["uro.contribution.01ARZ3NDEKTSV4RRFFQ69G5FAV"]
      },
      "human_review": {
        "scope": "none",
        "coverage_record_ids": []
      },
      "evidence_cutoff": "2026-09-23"
    }
  ],
  "evidence_cutoff": "2026-09-23",
  "generated_at": "2026-09-23T12:00:00Z"
}
